{
  "$schema": "https://json-schema.org/draft/2020-12/schema",
  "$id": "https://github.com/chuanseng-ng/digital-chip-design-agents/blob/main/docs/design_state.schema.json",
  "title": "design_state.json",
  "description": "数字 RTL→GDSII 与验证流水线中，各 Orchestrator 共享的跨领域状态。它是 memory/README.md 与 plugins/meta/skills/pipeline-orchestration/SKILL.md 中文字版 schema 的机器可读配套定义，同时验证 design_state.json 的 fix_request 与 checkpoint 两种变体。",
  "type": "object",
  "required": [
    "format_version"
  ],
  "additionalProperties": true,
  "properties": {
    "format_version": {
      "enum": [
        "1.1",
        "1.2",
        "1.3",
        "1.4",
        "1.5"
      ]
    },
    "design_name": {
      "type": [
        "string",
        "null"
      ]
    },
    "created_at": {
      "type": [
        "string",
        "null"
      ]
    },
    "updated_at": {
      "type": [
        "string",
        "null"
      ]
    },
    "cross_domain_iteration_count": {
      "type": [
        "integer",
        "null"
      ],
      "minimum": 0
    },
    "pipeline_session_id": {
      "type": [
        "string",
        "null"
      ]
    },
    "pipeline_config": {
      "type": "object",
      "additionalProperties": true,
      "properties": {
        "max_cross_domain_iterations": {
          "type": "integer",
          "minimum": 0
        },
        "checkpoints": {
          "type": "array",
          "items": {
            "type": "string"
          }
        }
      }
    },
    "pending_approval": {
      "oneOf": [
        {
          "type": "null"
        },
        {
          "type": "object",
          "required": [
            "type"
          ],
          "additionalProperties": true,
          "properties": {
            "type": {
              "enum": [
                "checkpoint",
                "escalation",
                "constraint_gap"
              ]
            }
          }
        }
      ]
    },
    "approved_checkpoints": {
      "type": "array",
      "items": {
        "type": "object",
        "required": [
          "stage"
        ],
        "additionalProperties": true,
        "properties": {
          "stage": {
            "type": "string"
          }
        }
      }
    },
    "constraints": {
      "type": "object",
      "additionalProperties": true
    },
    "fix_requests": {
      "type": "array",
      "items": {
        "$ref": "#/$defs/fixRequest"
      }
    },
    "archive_fix_requests": {
      "type": "array",
      "items": {
        "$ref": "#/$defs/fixRequest"
      }
    },
    "history": {
      "type": "array",
      "items": {
        "$ref": "#/$defs/historyEntry"
      }
    }
  },
  "$defs": {
    "confidence": {
      "enum": [
        "high",
        "medium",
        "low"
      ]
    },
    "historyFailureClass": {
      "enum": [
        "none",
        "functional",
        "timing",
        "power_area",
        "drc_lvs",
        "coverage_gap",
        "connectivity",
        "tool_error",
        "spec_gap",
        "resource_limit"
      ]
    },
    "retryStrategy": {
      "enum": [
        "none",
        "regenerate",
        "refine",
        "escalate"
      ]
    },
    "suggestedNextStep": {
      "anyOf": [
        {
          "enum": [
            "proceed",
            "retry_stage",
            "escalate",
            "abandon"
          ]
        },
        {
          "type": "string",
          "pattern": "^loop_back_to:"
        }
      ]
    },
    "fixRequest": {
      "type": "object",
      "additionalProperties": true,
      "required": [
        "id",
        "created_at",
        "updated_at",
        "created_by",
        "failure_class",
        "test_name",
        "property_or_assertion",
        "seed",
        "waveform_path",
        "log_path",
        "suspected_rtl",
        "summary",
        "expected_behavior",
        "observed_behavior",
        "session_id",
        "status",
        "rtl_response",
        "history"
      ],
      "properties": {
        "id": {
          "type": "string"
        },
        "created_at": {
          "type": "string"
        },
        "updated_at": {
          "type": "string"
        },
        "created_by": {
          "type": "string"
        },
        "failure_class": {
          "enum": [
            "functional",
            "protocol",
            "coverage_gap",
            "formal_cex"
          ]
        },
        "retry_strategy": {
          "$ref": "#/$defs/retryStrategy"
        },
        "test_name": {
          "type": "string"
        },
        "property_or_assertion": {
          "type": [
            "string",
            "null"
          ]
        },
        "seed": {
          "type": [
            "integer",
            "null"
          ]
        },
        "waveform_path": {
          "type": [
            "string",
            "null"
          ]
        },
        "log_path": {
          "type": [
            "string",
            "null"
          ]
        },
        "summary": {
          "type": "string"
        },
        "expected_behavior": {
          "type": [
            "string",
            "null"
          ]
        },
        "observed_behavior": {
          "type": "string"
        },
        "session_id": {
          "type": [
            "string",
            "null"
          ]
        },
        "route_to": {
          "type": "string",
          "description": "可选、预留的前向兼容 dispatch 提示，用于指定负责处理该 fix 的 servicer domain（默认 rtl-design）。当前尚未实现 multi-servicer dispatch，pipeline-orchestrator 仍固定调用 RTL Orchestrator；预留该字段是为了未来增加其他 fix-servicer domain 时无需迁移 contract。"
        },
        "status": {
          "enum": [
            "open",
            "claimed",
            "fixed",
            "abandoned"
          ]
        },
        "suspected_rtl": {
          "type": "object",
          "required": [
            "module",
            "signal",
            "file",
            "line_range"
          ],
          "additionalProperties": true
        },
        "rtl_response": {
          "type": [
            "object",
            "null"
          ]
        },
        "history": {
          "type": "array",
          "items": {
            "type": "object",
            "additionalProperties": true,
            "properties": {
              "from_status": {
                "type": [
                  "string",
                  "null"
                ]
              },
              "to_status": {
                "type": [
                  "string",
                  "null"
                ]
              }
            }
          }
        }
      }
    },
    "historyEntry": {
      "type": "object",
      "additionalProperties": true,
      "required": [
        "confidence",
        "failure_class",
        "retry_strategy",
        "suggested_next_step"
      ],
      "properties": {
        "confidence": {
          "$ref": "#/$defs/confidence"
        },
        "failure_class": {
          "$ref": "#/$defs/historyFailureClass"
        },
        "retry_strategy": {
          "$ref": "#/$defs/retryStrategy"
        },
        "suggested_next_step": {
          "$ref": "#/$defs/suggestedNextStep"
        }
      },
      "comment": "failure_class → retry_strategy 映射（与 validate.yml 的 RETRY_STRATEGY_MAP 一致）在下方以声明式规则强制执行；每个 history failure_class 只允许唯一对应的 retry_strategy。",
      "allOf": [
        {
          "if": {
            "properties": {
              "failure_class": {
                "const": "none"
              }
            }
          },
          "then": {
            "properties": {
              "retry_strategy": {
                "const": "none"
              }
            }
          }
        },
        {
          "if": {
            "properties": {
              "failure_class": {
                "const": "functional"
              }
            }
          },
          "then": {
            "properties": {
              "retry_strategy": {
                "const": "refine"
              }
            }
          }
        },
        {
          "if": {
            "properties": {
              "failure_class": {
                "const": "timing"
              }
            }
          },
          "then": {
            "properties": {
              "retry_strategy": {
                "const": "refine"
              }
            }
          }
        },
        {
          "if": {
            "properties": {
              "failure_class": {
                "const": "power_area"
              }
            }
          },
          "then": {
            "properties": {
              "retry_strategy": {
                "const": "refine"
              }
            }
          }
        },
        {
          "if": {
            "properties": {
              "failure_class": {
                "const": "coverage_gap"
              }
            }
          },
          "then": {
            "properties": {
              "retry_strategy": {
                "const": "refine"
              }
            }
          }
        },
        {
          "if": {
            "properties": {
              "failure_class": {
                "const": "connectivity"
              }
            }
          },
          "then": {
            "properties": {
              "retry_strategy": {
                "const": "refine"
              }
            }
          }
        },
        {
          "if": {
            "properties": {
              "failure_class": {
                "const": "drc_lvs"
              }
            }
          },
          "then": {
            "properties": {
              "retry_strategy": {
                "const": "regenerate"
              }
            }
          }
        },
        {
          "if": {
            "properties": {
              "failure_class": {
                "const": "tool_error"
              }
            }
          },
          "then": {
            "properties": {
              "retry_strategy": {
                "const": "regenerate"
              }
            }
          }
        },
        {
          "if": {
            "properties": {
              "failure_class": {
                "const": "spec_gap"
              }
            }
          },
          "then": {
            "properties": {
              "retry_strategy": {
                "const": "escalate"
              }
            }
          }
        },
        {
          "if": {
            "properties": {
              "failure_class": {
                "const": "resource_limit"
              }
            }
          },
          "then": {
            "properties": {
              "retry_strategy": {
                "const": "escalate"
              }
            }
          }
        }
      ]
    }
  }
}
