{
  "format_version": "1.5",
  "design_name": "example_mac_unit",
  "created_at": "2025-01-15T10:00:00Z",
  "updated_at": "2025-01-15T12:30:00Z",
  "cross_domain_iteration_count": 1,
  "pipeline_session_id": null,
  "pipeline_config": {
    "max_cross_domain_iterations": 3
  },
  "pending_approval": null,
  "fix_requests": [
    {
      "id": "fr_20250115_103000_001",
      "created_at": "2025-01-15T10:30:00Z",
      "updated_at": "2025-01-15T12:00:00Z",
      "created_by": "verification-orchestrator",
      "failure_class": "functional",
      "retry_strategy": "refine",
      "test_name": "test_mac_overflow",
      "property_or_assertion": null,
      "seed": 42,
      "waveform_path": "sim/waves/test_mac_overflow_42.vcd",
      "log_path": "sim/logs/test_mac_overflow_42.log",
      "suspected_rtl": {
        "module": "mac_unit",
        "signal": "acc_reg",
        "file": "rtl/mac_unit.sv",
        "line_range": [
          45,
          52
        ]
      },
      "summary": "输入超过 14-bit 范围时，Accumulator 溢出但没有被显式处理",
      "expected_behavior": "按照规格 §3.2，发生溢出时应饱和到 MAX_VAL（0x3FFF）",
      "observed_behavior": "acc_reg 发生回绕并变为 0，而不是饱和",
      "session_id": "ps_20250115_103000",
      "status": "fixed",
      "rtl_response": {
        "fixed_at": "2025-01-15T12:00:00Z",
        "diff_summary": "在 mac_unit.sv 第 45–52 行加入饱和逻辑：使用加法器 carry-out 的 overflow flag，将普通算术加法替换为带上限钳位的加法。",
        "files_changed": [
          "rtl/mac_unit.sv"
        ],
        "commit_ref": null
      },
      "history": [
        {
          "timestamp": "2025-01-15T10:30:00Z",
          "agent": "verification-orchestrator",
          "from_status": null,
          "to_status": "open",
          "note": "在 directed_tests 阶段发现 DUT bug"
        },
        {
          "timestamp": "2025-01-15T11:00:00Z",
          "agent": "rtl-design-orchestrator",
          "from_status": "open",
          "to_status": "claimed",
          "note": "由 pipeline-orchestrator 第 1 次 dispatch 后领取"
        },
        {
          "timestamp": "2025-01-15T12:00:00Z",
          "agent": "rtl-design-orchestrator",
          "from_status": "claimed",
          "to_status": "fixed",
          "note": "已应用饱和逻辑修复"
        }
      ]
    }
  ],
  "history": [
    {
      "timestamp": "2025-01-15T10:00:00Z",
      "agent": "rtl-design-orchestrator",
      "stage": "rtl_signoff",
      "decision": "proceed",
      "confidence": "high",
      "failure_class": "none",
      "retry_strategy": "none",
      "suggested_next_step": "proceed",
      "reason": "RTL sign-off 已完成",
      "constraint_ref": null
    },
    {
      "timestamp": "2025-01-15T10:30:00Z",
      "agent": "verification-orchestrator",
      "stage": "directed_tests",
      "decision": "escalate",
      "confidence": "high",
      "failure_class": "functional",
      "retry_strategy": "refine",
      "suggested_next_step": "escalate",
      "reason": "发现 DUT bug——已创建 fix_request fr_20250115_103000_001",
      "constraint_ref": "fr_20250115_103000_001"
    },
    {
      "timestamp": "2025-01-15T12:00:00Z",
      "agent": "rtl-design-orchestrator",
      "stage": "rtl_coding",
      "decision": "proceed",
      "confidence": "high",
      "failure_class": "none",
      "retry_strategy": "none",
      "suggested_next_step": "proceed",
      "reason": "已应用 fr_20250115_103000_001 的修复",
      "constraint_ref": "fr_20250115_103000_001"
    },
    {
      "timestamp": "2025-01-15T12:30:00Z",
      "agent": "pipeline-orchestrator",
      "stage": "signoff_or_escalate",
      "decision": "proceed",
      "confidence": "high",
      "failure_class": "none",
      "retry_strategy": "none",
      "suggested_next_step": "proceed",
      "reason": "所有 fix_request 在 1 次迭代内完成闭环",
      "constraint_ref": "fr_20250115_103000_001"
    }
  ]
}
